{
  "$schema": "https://json-schema.org/draft/2020-12/schema",
  "$id": "https://federated-agent-web.dev/schemas/node-manifest.schema.json",
  "title": "FAW Node Manifest",
  "description": "Normative signed node manifest for the Federated Agent Web delegation contract. Self-signed; trust is established by local policy, pinning, signed history, or other out-of-band evidence.",
  "type": "object",
  "additionalProperties": false,
  "required": ["kind", "spec_version", "id", "issued_at", "issuer", "body", "signature"],
  "properties": {
    "kind": { "const": "faw-node-manifest" },
    "spec_version": { "enum": ["0.2"] },
    "id": { "type": "string", "pattern": "^[0-9a-f]{8}-[0-9a-f]{4}-[47][0-9a-f]{3}-[89ab][0-9a-f]{3}-[0-9a-f]{12}$" },
    "issued_at": { "type": "string", "pattern": "^\\d{4}-\\d{2}-\\d{2}T\\d{2}:\\d{2}:\\d{2}(\\.\\d{1,9})?Z$" },
    "issuer": {
      "type": "object",
      "additionalProperties": false,
      "required": ["node_id", "kid"],
      "properties": {
        "node_id": { "type": "string", "pattern": "^urn:faw:[a-z0-9](?:[a-z0-9._-]{0,62})$" },
        "kid": { "type": "string", "pattern": "^sha256:[0-9a-f]{64}$" }
      }
    },
    "body": {
      "type": "object",
      "additionalProperties": false,
      "required": [
        "node_id", "display_name", "manifest_sequence", "previous_manifest_digest",
        "manifest_freshness_window_seconds", "capabilities", "endpoints", "keys",
        "authorization_policy", "cost_class", "rate_limits", "status"
      ],
      "properties": {
        "node_id": { "type": "string", "pattern": "^urn:faw:[a-z0-9](?:[a-z0-9._-]{0,62})$" },
        "display_name": { "type": "string", "minLength": 1, "maxLength": 128 },
        "manifest_sequence": { "type": "integer", "minimum": 1 },
        "previous_manifest_digest": { "anyOf": [{ "type": "null" }, { "type": "string", "pattern": "^sha256:[0-9a-f]{64}$" }] },
        "manifest_freshness_window_seconds": { "type": "integer", "minimum": 1 },
        "capabilities": {
          "type": "array",
          "uniqueItems": true,
          "items": { "type": "string", "pattern": "^[a-z][a-z0-9]*(?:[._-][a-z0-9]+)*$" }
        },
        "endpoints": {
          "type": "array",
          "items": {
            "type": "object",
            "additionalProperties": false,
            "required": ["type", "address"],
            "properties": {
              "type": { "type": "string", "pattern": "^[a-z][a-z0-9]*(?:[._-][a-z0-9]+)*$" },
              "address": { "type": "string", "minLength": 1, "maxLength": 512 }
            }
          }
        },
        "keys": {
          "type": "array",
          "minItems": 1,
          "items": {
            "type": "object",
            "additionalProperties": false,
            "required": ["kid", "alg", "public_key", "status", "valid_from"],
            "properties": {
              "kid": { "type": "string", "pattern": "^sha256:[0-9a-f]{64}$" },
              "alg": { "const": "Ed25519" },
              "public_key": { "type": "string", "pattern": "^[A-Za-z0-9_-]{43}$" },
              "status": { "enum": ["active", "retired", "revoked"] },
              "valid_from": { "type": "string", "pattern": "^\\d{4}-\\d{2}-\\d{2}T\\d{2}:\\d{2}:\\d{2}(\\.\\d{1,9})?Z$" },
              "valid_until": { "type": "string", "pattern": "^\\d{4}-\\d{2}-\\d{2}T\\d{2}:\\d{2}:\\d{2}(\\.\\d{1,9})?Z$" },
              "revoked_at": { "type": "string", "pattern": "^\\d{4}-\\d{2}-\\d{2}T\\d{2}:\\d{2}:\\d{2}(\\.\\d{1,9})?Z$" },
              "replaces": { "type": "string", "pattern": "^sha256:[0-9a-f]{64}$" }
            }
          }
        },
        "authorization_policy": {
          "type": "object",
          "additionalProperties": false,
          "required": ["default_deny", "required_grants"],
          "properties": {
            "default_deny": { "type": "boolean" },
            "required_grants": {
              "type": "array",
              "uniqueItems": true,
              "items": { "type": "string", "pattern": "^[a-z][a-z0-9]*(?:[._-][a-z0-9]+)*$" }
            }
          }
        },
        "cost_class": {
          "type": "object",
          "additionalProperties": false,
          "required": ["tier"],
          "properties": {
            "tier": { "enum": ["free", "low", "standard", "premium"] }
          }
        },
        "rate_limits": {
          "type": "object",
          "additionalProperties": false,
          "properties": {
            "max_concurrent": { "type": "integer", "minimum": 0 },
            "requests_per_minute": { "type": "integer", "minimum": 0 },
            "max_wall_seconds": { "type": "integer", "minimum": 0 },
            "max_output_bytes": { "type": "integer", "minimum": 0 }
          }
        },
        "status": { "enum": ["active", "paused", "retired"] }
      }
    },
    "signature": {
      "type": "object",
      "additionalProperties": false,
      "required": ["alg", "value"],
      "properties": {
        "alg": { "const": "Ed25519" },
        "value": { "type": "string", "pattern": "^[A-Za-z0-9_-]{86}$" }
      }
    }
  }
}
