{
  "kind": "faw-node-manifest",
  "spec_version": "0.2",
  "id": "10000000-0000-4000-8000-000000000004",
  "issued_at": "2026-01-01T00:00:00Z",
  "issuer": {
    "node_id": "urn:faw:conformance-rotation-0001",
    "kid": "sha256:eb4caae319bdcd70a1c0a28f2b9a4b655c8b6f8f411b5d8734afa549b841280d"
  },
  "body": {
    "node_id": "urn:faw:conformance-rotation-0001",
    "display_name": "conformance fixture node",
    "manifest_sequence": 1,
    "previous_manifest_digest": null,
    "manifest_freshness_window_seconds": 3600,
    "capabilities": [
      "hash_file"
    ],
    "endpoints": [],
    "keys": [
      {
        "kid": "sha256:eb4caae319bdcd70a1c0a28f2b9a4b655c8b6f8f411b5d8734afa549b841280d",
        "alg": "Ed25519",
        "public_key": "NDgsQf0OhUCTUENrK99m4VAGgjlCPuhH75-60zSvd6s",
        "status": "active",
        "valid_from": "2026-01-01T00:00:00Z"
      }
    ],
    "authorization_policy": {
      "default_deny": true,
      "required_grants": []
    },
    "cost_class": {
      "tier": "free"
    },
    "rate_limits": {},
    "status": "active"
  },
  "signature": {
    "alg": "Ed25519",
    "value": "SWd0RS_Q7C_Tyz_uM1hj5UkgBaPatVAPpjNaeHEkPox5p0Zo0130DpN_FIBtPNHmOjgKNpuVsiYDNelsqsfuDA"
  }
}
